

Last Git Status:
No changes found

============================================================
[2025-12-14 21:30:02]
============================================================
ERROR: Error executing git commands: Error in git push: ssh: Could not resolve hostname github.com: No such host is known. 
fatal: Could not read from remote repository.

Please make sure you have the correct access rights
and the repository exists.


============================================================
[2025-12-14 21:34:54]
============================================================
GIT AUTO OPERATION FAILED
Time: 2025-12-14 21:34:54
Error: Error executing git commands: Error in git push: ssh: Could not resolve hostname github.com: No such host is known. 
fatal: Could not read from remote repository.

Please make sure you have the correct access rights
and the repository exists.


Last Git Status:
No changes found

============================================================
[2025-12-14 21:34:54]
============================================================
ERROR: Error executing git commands: Error in git push: ssh: Could not resolve hostname github.com: No such host is known. 
fatal: Could not read from remote repository.

Please make sure you have the correct access rights
and the repository exists.


============================================================
[2025-12-14 21:39:45]
============================================================
GIT AUTO OPERATION FAILED
Time: 2025-12-14 21:39:45
Error: Error executing git commands: Error in git push: ssh: Could not resolve hostname github.com: No such host is known. 
fatal: Could not read from remote repository.

Please make sure you have the correct access rights
and the repository exists.


Last Git Status:
No changes found

============================================================
[2025-12-14 21:39:45]
============================================================
ERROR: Error executing git commands: Error in git push: ssh: Could not resolve hostname github.com: No such host is known. 
fatal: Could not read from remote repository.

Please make sure you have the correct access rights
and the repository exists.


============================================================
[2025-12-14 21:44:37]
============================================================
GIT AUTO OPERATION FAILED
Time: 2025-12-14 21:44:37
Error: Error executing git commands: Error in git push: ssh: Could not resolve hostname github.com: No such host is known. 
fatal: Could not read from remote repository.

Please make sure you have the correct access rights
and the repository exists.


Last Git Status:
No changes found

============================================================
[2025-12-14 21:44:37]
============================================================
ERROR: Error executing git commands: Error in git push: ssh: Could not resolve hostname github.com: No such host is known. 
fatal: Could not read from remote repository.

Please make sure you have the correct access rights
and the repository exists.


============================================================
[2025-12-14 21:49:29]
============================================================
GIT AUTO OPERATION FAILED
Time: 2025-12-14 21:49:29
Error: Error executing git commands: Error in git push: ssh: Could not resolve hostname github.com: No such host is known. 
fatal: Could not read from remote repository.

Please make sure you have the correct access rights
and the repository exists.


Last Git Status:
No changes found

============================================================
[2025-12-14 21:49:29]
============================================================
ERROR: Error executing git commands: Error in git push: ssh: Could not resolve hostname github.com: No such host is known. 
fatal: Could not read from remote repository.

Please make sure you have the correct access rights
and the repository exists.


============================================================
[2025-12-14 21:54:20]
============================================================
GIT AUTO OPERATION FAILED
Time: 2025-12-14 21:54:20
Error: Error executing git commands: Error in git push: ssh: Could not resolve hostname github.com: No such host is known. 
fatal: Could not read from remote repository.

Please make sure you have the correct access rights
and the repository exists.


Last Git Status:
No changes found

============================================================
[2025-12-14 21:54:20]
============================================================
ERROR: Error executing git commands: Error in git push: ssh: Could not resolve hostname github.com: No such host is known. 
fatal: Could not read from remote repository.

Please make sure you have the correct access rights
and the repository exists.


============================================================
[2025-12-14 21:59:12]
============================================================
GIT AUTO OPERATION FAILED
Time: 2025-12-14 21:59:12
Error: Error executing git commands: Error in git push: ssh: Could not resolve hostname github.com: No such host is known. 
fatal: Could not read from remote repository.

Please make sure you have the correct access rights
and the repository exists.


Last Git Status:
No changes found

============================================================
[2025-12-14 21:59:12]
============================================================
ERROR: Error executing git commands: Error in git push: ssh: Could not resolve hostname github.com: No such host is known. 
fatal: Could not read from remote repository.

Please make sure you have the correct access rights
and the repository exists.


============================================================
[2025-12-14 22:04:04]
============================================================
GIT AUTO OPERATION FAILED
Time: 2025-12-14 22:04:04
Error: Error executing git commands: Error in git push: ssh: Could not resolve hostname github.com: No such host is known. 
fatal: Could not read from remote repository.

Please make sure you have the correct access rights
and the repository exists.


Last Git Status:
No changes found

============================================================
[2025-12-14 22:04:04]
============================================================
ERROR: Error executing git commands: Error in git push: ssh: Could not resolve hostname github.com: No such host is known. 
fatal: Could not read from remote repository.

Please make sure you have the correct access rights
and the repository exists.


============================================================
[2025-12-14 22:08:56]
============================================================
GIT AUTO OPERATION FAILED
Time: 2025-12-14 22:08:56
Error: Error executing git commands: Error in git push: ssh: Could not resolve hostname github.com: No such host is known. 
fatal: Could not read from remote repository.

Please make sure you have the correct access rights
and the repository exists.


Last Git Status:
No changes found

============================================================
[2025-12-14 22:08:56]
============================================================
ERROR: Error executing git commands: Error in git push: ssh: Could not resolve hostname github.com: No such host is known. 
fatal: Could not read from remote repository.

Please make sure you have the correct access rights
and the repository exists.


============================================================
[2025-12-14 22:13:47]
============================================================
GIT AUTO OPERATION FAILED
Time: 2025-12-14 22:13:47
Error: Error executing git commands: Error in git push: ssh: Could not resolve hostname github.com: No such host is known. 
fatal: Could not read from remote repository.

Please make sure you have the correct access rights
and the repository exists.


Last Git Status:
No changes found

============================================================
[2025-12-14 22:13:47]
============================================================
ERROR: Error executing git commands: Error in git push: ssh: Could not resolve hostname github.com: No such host is known. 
fatal: Could not read from remote repository.

Please make sure you have the correct access rights
and the repository exists.


============================================================
[2025-12-14 22:18:39]
============================================================
GIT AUTO OPERATION FAILED
Time: 2025-12-14 22:18:39
Error: Error executing git commands: Error in git push: ssh: Could not resolve hostname github.com: No such host is known. 
fatal: Could not read from remote repository.

Please make sure you have the correct access rights
and the repository exists.


Last Git Status:
No changes found

============================================================
[2025-12-14 22:18:39]
============================================================
ERROR: Error executing git commands: Error in git push: ssh: Could not resolve hostname github.com: No such host is known. 
fatal: Could not read from remote repository.

Please make sure you have the correct access rights
and the repository exists.


============================================================
[2025-12-14 22:23:31]
============================================================
GIT AUTO OPERATION FAILED
Time: 2025-12-14 22:23:31
Error: Error executing git commands: Error in git push: ssh: Could not resolve hostname github.com: No such host is known. 
fatal: Could not read from remote repository.

Please make sure you have the correct access rights
and the repository exists.


Last Git Status:
No changes found

============================================================
[2025-12-14 22:23:31]
============================================================
ERROR: Error executing git commands: Error in git push: ssh: Could not resolve hostname github.com: No such host is known. 
fatal: Could not read from remote repository.

Please make sure you have the correct access rights
and the repository exists.


============================================================
[2025-12-14 22:28:23]
============================================================
GIT AUTO OPERATION FAILED
Time: 2025-12-14 22:28:23
Error: Error executing git commands: Error in git push: ssh: Could not resolve hostname github.com: No such host is known. 
fatal: Could not read from remote repository.

Please make sure you have the correct access rights
and the repository exists.


Last Git Status:
No changes found

============================================================
[2025-12-14 22:28:23]
============================================================
ERROR: Error executing git commands: Error in git push: ssh: Could not resolve hostname github.com: No such host is known. 
fatal: Could not read from remote repository.

Please make sure you have the correct access rights
and the repository exists.


============================================================
[2025-12-14 22:33:14]
============================================================
GIT AUTO OPERATION FAILED
Time: 2025-12-14 22:33:14
Error: Error executing git commands: Error in git push: ssh: Could not resolve hostname github.com: No such host is known. 
fatal: Could not read from remote repository.

Please make sure you have the correct access rights
and the repository exists.


Last Git Status:
No changes found

============================================================
[2025-12-14 22:33:14]
============================================================
ERROR: Error executing git commands: Error in git push: ssh: Could not resolve hostname github.com: No such host is known. 
fatal: Could not read from remote repository.

Please make sure you have the correct access rights
and the repository exists.


============================================================
[2025-12-14 22:38:06]
============================================================
GIT AUTO OPERATION FAILED
Time: 2025-12-14 22:38:06
Error: Error executing git commands: Error in git push: ssh: Could not resolve hostname github.com: No such host is known. 
fatal: Could not read from remote repository.

Please make sure you have the correct access rights
and the repository exists.


Last Git Status:
No changes found

============================================================
[2025-12-14 22:38:06]
============================================================
ERROR: Error executing git commands: Error in git push: ssh: Could not resolve hostname github.com: No such host is known. 
fatal: Could not read from remote repository.

Please make sure you have the correct access rights
and the repository exists.


============================================================
[2025-12-14 22:42:58]
============================================================
GIT AUTO OPERATION FAILED
Time: 2025-12-14 22:42:58
Error: Error executing git commands: Error in git push: ssh: Could not resolve hostname github.com: No such host is known. 
fatal: Could not read from remote repository.

Please make sure you have the correct access rights
and the repository exists.


Last Git Status:
No changes found

============================================================
[2025-12-14 22:42:58]
============================================================
ERROR: Error executing git commands: Error in git push: ssh: Could not resolve hostname github.com: No such host is known. 
fatal: Could not read from remote repository.

Please make sure you have the correct access rights
and the repository exists.


============================================================
[2025-12-14 22:47:50]
============================================================
GIT AUTO OPERATION FAILED
Time: 2025-12-14 22:47:49
Error: Error executing git commands: Error in git push: ssh: Could not resolve hostname github.com: No such host is known. 
fatal: Could not read from remote repository.

Please make sure you have the correct access rights
and the repository exists.


Last Git Status:
No changes found

============================================================
[2025-12-14 22:47:50]
============================================================
ERROR: Error executing git commands: Error in git push: ssh: Could not resolve hostname github.com: No such host is known. 
fatal: Could not read from remote repository.

Please make sure you have the correct access rights
and the repository exists.


============================================================
[2025-12-14 22:52:41]
============================================================
GIT AUTO OPERATION FAILED
Time: 2025-12-14 22:52:41
Error: Error executing git commands: Error in git push: ssh: Could not resolve hostname github.com: No such host is known. 
fatal: Could not read from remote repository.

Please make sure you have the correct access rights
and the repository exists.


Last Git Status:
No changes found

============================================================
[2025-12-14 22:52:41]
============================================================
ERROR: Error executing git commands: Error in git push: ssh: Could not resolve hostname github.com: No such host is known. 
fatal: Could not read from remote repository.

Please make sure you have the correct access rights
and the repository exists.


============================================================
[2025-12-14 22:57:33]
============================================================
GIT AUTO OPERATION FAILED
Time: 2025-12-14 22:57:33
Error: Error executing git commands: Error in git push: ssh: Could not resolve hostname github.com: No such host is known. 
fatal: Could not read from remote repository.

Please make sure you have the correct access rights
and the repository exists.


Last Git Status:
No changes found

============================================================
[2025-12-14 22:57:33]
============================================================
ERROR: Error executing git commands: Error in git push: ssh: Could not resolve hostname github.com: No such host is known. 
fatal: Could not read from remote repository.

Please make sure you have the correct access rights
and the repository exists.


============================================================
[2025-12-14 23:02:25]
============================================================
GIT AUTO OPERATION FAILED
Time: 2025-12-14 23:02:25
Error: Error executing git commands: Error in git push: ssh: Could not resolve hostname github.com: No such host is known. 
fatal: Could not read from remote repository.

Please make sure you have the correct access rights
and the repository exists.


Last Git Status:
No changes found

============================================================
[2025-12-14 23:02:25]
============================================================
ERROR: Error executing git commands: Error in git push: ssh: Could not resolve hostname github.com: No such host is known. 
fatal: Could not read from remote repository.

Please make sure you have the correct access rights
and the repository exists.


============================================================
[2025-12-14 23:07:16]
============================================================
GIT AUTO OPERATION FAILED
Time: 2025-12-14 23:07:16
Error: Error executing git commands: Error in git push: ssh: Could not resolve hostname github.com: No such host is known. 
fatal: Could not read from remote repository.

Please make sure you have the correct access rights
and the repository exists.


Last Git Status:
No changes found

============================================================
[2025-12-14 23:07:17]
============================================================
ERROR: Error executing git commands: Error in git push: ssh: Could not resolve hostname github.com: No such host is known. 
fatal: Could not read from remote repository.

Please make sure you have the correct access rights
and the repository exists.


============================================================
[2025-12-14 23:12:21]
============================================================
GIT AUTO OPERATION STARTED
Time: 2025-12-14 23:12:11

1. GIT ADD
----------------------------------------
✓ git add completed
Output: 

2. GIT COMMIT
----------------------------------------
✓ git commit completed
Commit Hash: 385fd1a (385fd1a0c7839272c319727ee37848adfcfd2653)
Commit Message:
14.12.25 23:12:11
Django project changes:

Added files:
- git_auto_errors/error_20251214_230717.txt

Modified files:
- it_auto_log.txt
Output: [main 385fd1a] 14.12.25 23:12:11 Django project changes:
 2 files changed, 34 insertions(+)
 create mode 100644 git_auto_errors/error_20251214_230717.txt

3. GIT PUSH
----------------------------------------
✓ git push completed
Branch: main
Output: branch 'main' set up to track 'origin/main'.

4. PUSH VERIFICATION
----------------------------------------
✓ Push verified successfully
Local Commit:  385fd1a0c7839272c319727ee37848adfcfd2653
Remote Commit: 385fd1a0c7839272c319727ee37848adfcfd2653
Match: Yes

5. GIT INFORMATION SUMMARY
----------------------------------------
Current Branch: main
Git User: Sina Lalebakhsh <lalebakhshsina@gmail.com>
Total Commits: 442

Remote URLs:
origin	git@github.com:sinalalebakhsh/acronproject.git (fetch)
origin	git@github.com:sinalalebakhsh/acronproject.git (push)

Recent Commits (last 5):
385fd1a 14.12.25 23:12:11 Django project changes:
3980396 14.12.25 23:07:16 Django project changes:
ded02d0 14.12.25 23:02:24 Django project changes:
a8c1c34 14.12.25 22:57:32 Django project changes:
7017fc1 14.12.25 22:52:41 Django project changes:

Current Status:
Clean working directory

OPERATION COMPLETED SUCCESSFULLY
Time: 2025-12-14 23:12:21
Commit: 385fd1a

============================================================
[2025-12-14 23:17:23]
============================================================
GIT AUTO OPERATION STARTED
Time: 2025-12-14 23:17:14

1. GIT ADD
----------------------------------------
✓ git add completed
Output: 

2. GIT COMMIT
----------------------------------------
✓ git commit completed
Commit Hash: 7b26630 (7b26630c1eda094f3de837a0ee0afd085a03b480)
Commit Message:
14.12.25 23:17:14
Django project changes:

Modified files:
- it_auto_log.txt
Output: [main 7b26630] 14.12.25 23:17:14 Django project changes:
 1 file changed, 65 insertions(+)

3. GIT PUSH
----------------------------------------
✓ git push completed
Branch: main
Output: branch 'main' set up to track 'origin/main'.

4. PUSH VERIFICATION
----------------------------------------
✓ Push verified successfully
Local Commit:  7b26630c1eda094f3de837a0ee0afd085a03b480
Remote Commit: 7b26630c1eda094f3de837a0ee0afd085a03b480
Match: Yes

5. GIT INFORMATION SUMMARY
----------------------------------------
Current Branch: main
Git User: Sina Lalebakhsh <lalebakhshsina@gmail.com>
Total Commits: 443

Remote URLs:
origin	git@github.com:sinalalebakhsh/acronproject.git (fetch)
origin	git@github.com:sinalalebakhsh/acronproject.git (push)

Recent Commits (last 5):
7b26630 14.12.25 23:17:14 Django project changes:
385fd1a 14.12.25 23:12:11 Django project changes:
3980396 14.12.25 23:07:16 Django project changes:
ded02d0 14.12.25 23:02:24 Django project changes:
a8c1c34 14.12.25 22:57:32 Django project changes:

Current Status:
Clean working directory

OPERATION COMPLETED SUCCESSFULLY
Time: 2025-12-14 23:17:23
Commit: 7b26630

============================================================
[2025-12-14 23:19:18]
============================================================
SCRIPT STOPPED BY USER
Time: 2025-12-14 23:19:18
Total checks performed: 174
Final internet status: Connected
Pending operations: No
Log file: git_auto_log.txt
Max log lines configured: 2000

================================================================================
GIT AUTO SCRIPT STARTED (Interactive Mode)
Time: 2025-12-14 23:41:47
Configuration: {'initial_interval': 60, 'normal_interval': 300, 'initial_checks': 3, 'max_retries': 3, 'error_log_dir': 'git_auto_errors', 'timeout': 10, 'branch': 'main', 'log_file': 'git_auto_log.txt', 'max_log_lines': 2000, 'log_rotation_size': 1000}
PID: 25864
Interactive command: Press 'r' during wait
Force run file: force_git_run.flag
================================================================================

============================================================
[2025-12-14 23:42:01]
============================================================
GIT AUTO OPERATION STARTED
Time: 2025-12-14 23:41:52

1. GIT ADD
----------------------------------------
✓ git add completed
Output: 

2. GIT COMMIT
----------------------------------------
✓ git commit completed
Commit Hash: c26f3a5 (c26f3a513c4368a8b915375c41cfe19b07984a04)
Commit Message:
14.12.25 23:41:52
Django project changes:

Added files:
- LICENSE
- force_git_run.flag

Modified files:
- it_auto.py
- git_auto_log.txt
Output: [main c26f3a5] 14.12.25 23:41:52 Django project changes:
 4 files changed, 277 insertions(+), 70 deletions(-)
 create mode 100644 LICENSE
 create mode 100644 force_git_run.flag

3. GIT PUSH
----------------------------------------
✓ git push completed
Branch: main
Output: branch 'main' set up to track 'origin/main'.

4. PUSH VERIFICATION
----------------------------------------
✓ Push verified successfully
Local Commit:  c26f3a513c4368a8b915375c41cfe19b07984a04
Remote Commit: c26f3a513c4368a8b915375c41cfe19b07984a04
Match: Yes

5. GIT INFORMATION SUMMARY
----------------------------------------
Current Branch: main
Git User: Sina Lalebakhsh <lalebakhshsina@gmail.com>
Total Commits: 444

Remote URLs:
origin	git@github.com:sinalalebakhsh/acronproject.git (fetch)
origin	git@github.com:sinalalebakhsh/acronproject.git (push)

Recent Commits (last 5):
c26f3a5 14.12.25 23:41:52 Django project changes:
7b26630 14.12.25 23:17:14 Django project changes:
385fd1a 14.12.25 23:12:11 Django project changes:
3980396 14.12.25 23:07:16 Django project changes:
ded02d0 14.12.25 23:02:24 Django project changes:

Current Status:
Clean working directory

OPERATION COMPLETED SUCCESSFULLY
Time: 2025-12-14 23:42:01
Commit: c26f3a5

============================================================
[2025-12-14 23:42:13]
============================================================
🚨 IMMEDIATE GIT OPERATION STARTED (Manual Trigger)
Time: 2025-12-14 23:42:03

1. GIT ADD
----------------------------------------
✓ git add completed
Output: 

2. GIT COMMIT
----------------------------------------
✓ git commit completed
Commit Hash: e8023f8 (e8023f8bbb4529850b2dd35fa75ab5e3ba5cfdfe)
Commit Message:
14.12.25 23:42:03
Django project changes:

Modified files:
- git_auto_log.txt

Deleted files:
- orce_git_run.flag
Output: [main e8023f8] 14.12.25 23:42:03 Django project changes:
 2 files changed, 68 insertions(+), 1 deletion(-)
 delete mode 100644 force_git_run.flag

3. GIT PUSH
----------------------------------------
✓ git push completed
Branch: main
Output: branch 'main' set up to track 'origin/main'.

4. PUSH VERIFICATION
----------------------------------------
✓ Push verified successfully
Local Commit:  e8023f8bbb4529850b2dd35fa75ab5e3ba5cfdfe
Remote Commit: e8023f8bbb4529850b2dd35fa75ab5e3ba5cfdfe
Match: Yes

5. GIT INFORMATION SUMMARY
----------------------------------------
Current Branch: main
Git User: Sina Lalebakhsh <lalebakhshsina@gmail.com>
Total Commits: 445

Remote URLs:
origin	git@github.com:sinalalebakhsh/acronproject.git (fetch)
origin	git@github.com:sinalalebakhsh/acronproject.git (push)

Recent Commits (last 5):
e8023f8 14.12.25 23:42:03 Django project changes:
c26f3a5 14.12.25 23:41:52 Django project changes:
7b26630 14.12.25 23:17:14 Django project changes:
385fd1a 14.12.25 23:12:11 Django project changes:
3980396 14.12.25 23:07:16 Django project changes:

Current Status:
Clean working directory

🚨 IMMEDIATE OPERATION COMPLETED SUCCESSFULLY
Time: 2025-12-14 23:42:13
Commit: e8023f8

============================================================
[2025-12-14 23:43:24]
============================================================
GIT AUTO OPERATION STARTED
Time: 2025-12-14 23:43:15

1. GIT ADD
----------------------------------------
✓ git add completed
Output: 

2. GIT COMMIT
----------------------------------------
✓ git commit completed
Commit Hash: eb2574b (eb2574b3e54aa7303a4c4fad880d879b66cc0223)
Commit Message:
14.12.25 23:43:15
Django project changes:

Modified files:
- it_auto_log.txt
Output: [main eb2574b] 14.12.25 23:43:15 Django project changes:
 1 file changed, 65 insertions(+)

3. GIT PUSH
----------------------------------------
✓ git push completed
Branch: main
Output: branch 'main' set up to track 'origin/main'.

4. PUSH VERIFICATION
----------------------------------------
✓ Push verified successfully
Local Commit:  eb2574b3e54aa7303a4c4fad880d879b66cc0223
Remote Commit: eb2574b3e54aa7303a4c4fad880d879b66cc0223
Match: Yes

5. GIT INFORMATION SUMMARY
----------------------------------------
Current Branch: main
Git User: Sina Lalebakhsh <lalebakhshsina@gmail.com>
Total Commits: 446

Remote URLs:
origin	git@github.com:sinalalebakhsh/acronproject.git (fetch)
origin	git@github.com:sinalalebakhsh/acronproject.git (push)

Recent Commits (last 5):
eb2574b 14.12.25 23:43:15 Django project changes:
e8023f8 14.12.25 23:42:03 Django project changes:
c26f3a5 14.12.25 23:41:52 Django project changes:
7b26630 14.12.25 23:17:14 Django project changes:
385fd1a 14.12.25 23:12:11 Django project changes:

Current Status:
Clean working directory

OPERATION COMPLETED SUCCESSFULLY
Time: 2025-12-14 23:43:24
Commit: eb2574b

============================================================
[2025-12-14 23:44:29]
============================================================
SCRIPT STOPPED BY USER
Time: 2025-12-14 23:44:29
Total checks performed: 4
Final internet status: Connected
Pending operations: No
Log file: git_auto_log.txt
Max log lines configured: 2000

================================================================================
GIT AUTO SCRIPT STARTED (Interactive Mode)
Time: 2025-12-14 23:47:19
Configuration: {'initial_interval': 60, 'normal_interval': 300, 'initial_checks': 3, 'max_retries': 3, 'error_log_dir': 'git_auto_errors', 'timeout': 10, 'branch': 'main', 'log_file': 'git_auto_log.txt', 'max_log_lines': 2000, 'log_rotation_size': 1000}
PID: 26088
Interactive commands: run, execute, now, git, push, r
Force run file: force_git_run.flag
================================================================================

============================================================
[2025-12-14 23:47:35]
============================================================
GIT AUTO OPERATION STARTED
Time: 2025-12-14 23:47:25

1. GIT ADD
----------------------------------------
✓ git add completed
Output: 

2. GIT COMMIT
----------------------------------------
✓ git commit completed
Commit Hash: ebf8eda (ebf8edad073ccf1005f7fdf8e17769528069c79e)
Commit Message:
14.12.25 23:47:25
Django project changes:

Added files:
- git_auto_.py

Modified files:
- it_auto_log.txt
Output: [main ebf8eda] 14.12.25 23:47:25 Django project changes:
 2 files changed, 930 insertions(+)
 create mode 100644 git_auto_.py

3. GIT PUSH
----------------------------------------
✓ git push completed
Branch: main
Output: branch 'main' set up to track 'origin/main'.

4. PUSH VERIFICATION
----------------------------------------
✓ Push verified successfully
Local Commit:  ebf8edad073ccf1005f7fdf8e17769528069c79e
Remote Commit: ebf8edad073ccf1005f7fdf8e17769528069c79e
Match: Yes

5. GIT INFORMATION SUMMARY
----------------------------------------
Current Branch: main
Git User: Sina Lalebakhsh <lalebakhshsina@gmail.com>
Total Commits: 448

Remote URLs:
origin	git@github.com:sinalalebakhsh/acronproject.git (fetch)
origin	git@github.com:sinalalebakhsh/acronproject.git (push)

Recent Commits (last 5):
ebf8eda 14.12.25 23:47:25 Django project changes:
470c5c0 14.12.25 23:44:26 Django project changes:
eb2574b 14.12.25 23:43:15 Django project changes:
e8023f8 14.12.25 23:42:03 Django project changes:
c26f3a5 14.12.25 23:41:52 Django project changes:

Current Status:
Clean working directory

OPERATION COMPLETED SUCCESSFULLY
Time: 2025-12-14 23:47:35
Commit: ebf8eda

============================================================
[2025-12-14 23:48:46]
============================================================
GIT AUTO OPERATION STARTED
Time: 2025-12-14 23:48:38

1. GIT ADD
----------------------------------------
✓ git add completed
Output: 

2. GIT COMMIT
----------------------------------------
✓ git commit completed
Commit Hash: a923c7f (a923c7ff8f1d2d4d895fa5e44fadb7d6a69a49cb)
Commit Message:
14.12.25 23:48:38
Django project changes:

Modified files:
- it_auto_log.txt
Output: [main a923c7f] 14.12.25 23:48:38 Django project changes:
 1 file changed, 65 insertions(+)

3. GIT PUSH
----------------------------------------
✓ git push completed
Branch: main
Output: branch 'main' set up to track 'origin/main'.

4. PUSH VERIFICATION
----------------------------------------
✓ Push verified successfully
Local Commit:  a923c7ff8f1d2d4d895fa5e44fadb7d6a69a49cb
Remote Commit: a923c7ff8f1d2d4d895fa5e44fadb7d6a69a49cb
Match: Yes

5. GIT INFORMATION SUMMARY
----------------------------------------
Current Branch: main
Git User: Sina Lalebakhsh <lalebakhshsina@gmail.com>
Total Commits: 449

Remote URLs:
origin	git@github.com:sinalalebakhsh/acronproject.git (fetch)
origin	git@github.com:sinalalebakhsh/acronproject.git (push)

Recent Commits (last 5):
a923c7f 14.12.25 23:48:38 Django project changes:
ebf8eda 14.12.25 23:47:25 Django project changes:
470c5c0 14.12.25 23:44:26 Django project changes:
eb2574b 14.12.25 23:43:15 Django project changes:
e8023f8 14.12.25 23:42:03 Django project changes:

Current Status:
Clean working directory

OPERATION COMPLETED SUCCESSFULLY
Time: 2025-12-14 23:48:46
Commit: a923c7f

================================================================================
LOG FILE ROTATED
Time: 2025-12-14 23:49:11
Previous size: 2045 lines
New size: 1000 lines
Rotation threshold: 2000 lines
================================================================================


============================================================
[2025-12-14 23:49:11]
============================================================
SCRIPT STOPPED BY USER
Time: 2025-12-14 23:49:11
Total checks performed: 2
Final internet status: Connected
Pending operations: No
Log file: git_auto_log.txt
Max log lines configured: 2000

================================================================================
IMMEDIATE GIT PUSH STARTED
Time: 2025-12-15 00:08:16
Script: push.sh trigger
================================================================================

============================================================
[2025-12-15 00:08:20]
============================================================
IMMEDIATE GIT OPERATION STARTED
Time: 2025-12-15 00:08:16

1. GIT ADD
----------------------------------------
✓ git add completed
Output: 

2. GIT COMMIT
----------------------------------------
✓ git commit completed
Commit Hash: 9edd466
Commit Message:
15.12.25 00:08:16
Django project changes:

Added files:
- git_auto_simple.py
- push.bat

Modified files:
- git_auto_log.txt

Deleted files:
- it_auto.py
- git_auto_.py
Output: [main 9edd466] 15.12.25 00:08:16 Django project changes:
 5 files changed, 548 insertions(+), 2916 deletions(-)
 delete mode 100644 git_auto.py
 delete mode 100644 git_auto_.py
 create mode 100644 git_auto_simple.py
 create mode 100644 push.bat

3. GIT PUSH
----------------------------------------
✓ git push completed
Branch: main
Output: branch 'main' set up to track 'origin/main'.

4. GIT INFORMATION
----------------------------------------
Current Branch: main
Git User: Sina Lalebakhsh <lalebakhshsina@gmail.com>

Remote URLs:
origin	git@github.com:sinalalebakhsh/acronproject.git (fetch)
origin	git@github.com:sinalalebakhsh/acronproject.git (push)

Recent Commits (last 5):
9edd466 15.12.25 00:08:16 Django project changes:
a923c7f 14.12.25 23:48:38 Django project changes:
ebf8eda 14.12.25 23:47:25 Django project changes:
470c5c0 14.12.25 23:44:26 Django project changes:
eb2574b 14.12.25 23:43:15 Django project changes:

OPERATION COMPLETED SUCCESSFULLY
Time: 2025-12-15 00:08:20
Commit: 9edd466

================================================================================
IMMEDIATE GIT PUSH STARTED
Time: 2025-12-15 00:08:53
Script: push.sh trigger
================================================================================

============================================================
[2025-12-15 00:08:57]
============================================================
IMMEDIATE GIT OPERATION STARTED
Time: 2025-12-15 00:08:54

1. GIT ADD
----------------------------------------
✓ git add completed
Output: 

2. GIT COMMIT
----------------------------------------
✓ git commit completed
Commit Hash: 74fb926
Commit Message:
15.12.25 00:08:54
Django project changes:

Modified files:
- it_auto_log.txt
Output: [main 74fb926] 15.12.25 00:08:54 Django project changes:
 1 file changed, 68 insertions(+)

3. GIT PUSH
----------------------------------------
✓ git push completed
Branch: main
Output: branch 'main' set up to track 'origin/main'.

4. GIT INFORMATION
----------------------------------------
Current Branch: main
Git User: Sina Lalebakhsh <lalebakhshsina@gmail.com>

Remote URLs:
origin	git@github.com:sinalalebakhsh/acronproject.git (fetch)
origin	git@github.com:sinalalebakhsh/acronproject.git (push)

Recent Commits (last 5):
74fb926 15.12.25 00:08:54 Django project changes:
9edd466 15.12.25 00:08:16 Django project changes:
a923c7f 14.12.25 23:48:38 Django project changes:
ebf8eda 14.12.25 23:47:25 Django project changes:
470c5c0 14.12.25 23:44:26 Django project changes:

OPERATION COMPLETED SUCCESSFULLY
Time: 2025-12-15 00:08:57
Commit: 74fb926

================================================================================
IMMEDIATE GIT PUSH STARTED
Time: 2025-12-15 00:09:16
Script: push.sh trigger
================================================================================

============================================================
[2025-12-15 00:09:20]
============================================================
IMMEDIATE GIT OPERATION STARTED
Time: 2025-12-15 00:09:16

1. GIT ADD
----------------------------------------
✓ git add completed
Output: 

2. GIT COMMIT
----------------------------------------
✓ git commit completed
Commit Hash: ec49c53
Commit Message:
15.12.25 00:09:16
Django project changes:

Modified files:
- it_auto_log.txt
Output: [main ec49c53] 15.12.25 00:09:16 Django project changes:
 1 file changed, 56 insertions(+)

3. GIT PUSH
----------------------------------------
✓ git push completed
Branch: main
Output: branch 'main' set up to track 'origin/main'.

4. GIT INFORMATION
----------------------------------------
Current Branch: main
Git User: Sina Lalebakhsh <lalebakhshsina@gmail.com>

Remote URLs:
origin	git@github.com:sinalalebakhsh/acronproject.git (fetch)
origin	git@github.com:sinalalebakhsh/acronproject.git (push)

Recent Commits (last 5):
ec49c53 15.12.25 00:09:16 Django project changes:
74fb926 15.12.25 00:08:54 Django project changes:
9edd466 15.12.25 00:08:16 Django project changes:
a923c7f 14.12.25 23:48:38 Django project changes:
ebf8eda 14.12.25 23:47:25 Django project changes:

OPERATION COMPLETED SUCCESSFULLY
Time: 2025-12-15 00:09:20
Commit: ec49c53

================================================================================
GIT AUTO SCRIPT STARTED
Time: 2025-12-15 00:21:59
Configuration: {'initial_interval': 60, 'normal_interval': 300, 'initial_checks': 3, 'max_retries': 3, 'error_log_dir': 'git_auto_errors', 'timeout': 10, 'branch': 'main', 'log_file': 'git_auto_log.txt', 'max_log_lines': 2000, 'log_rotation_size': 1000}
Max log lines: 2000
Rotation size: 1000 lines
================================================================================

============================================================
[2025-12-15 00:22:15]
============================================================
GIT AUTO OPERATION STARTED
Time: 2025-12-15 00:22:06

1. GIT ADD
----------------------------------------
✓ git add completed
Output: 

2. GIT COMMIT
----------------------------------------
✓ git commit completed
Commit Hash: a29830a (a29830ac845ee1b96e60de90603cf15f5cb38670)
Commit Message:
15.12.25 00:22:06
Django project changes:

Added files:
- push_py.py

Modified files:
- gitignore
- git_auto_log.txt

Deleted files:
- git_auto_simple.py
- push.bat
Output: [main a29830a] 15.12.25 00:22:06 Django project changes:
 5 files changed, 892 insertions(+), 461 deletions(-)
 delete mode 100644 git_auto_simple.py
 delete mode 100644 push.bat
 create mode 100644 push_py.py

3. GIT PUSH
----------------------------------------
✓ git push completed
Branch: main
Output: branch 'main' set up to track 'origin/main'.

4. PUSH VERIFICATION
----------------------------------------
✓ Push verified successfully
Local Commit:  a29830ac845ee1b96e60de90603cf15f5cb38670
Remote Commit: a29830ac845ee1b96e60de90603cf15f5cb38670
Match: Yes

5. GIT INFORMATION SUMMARY
----------------------------------------
Current Branch: main
Git User: Sina Lalebakhsh <lalebakhshsina@gmail.com>
Total Commits: 454

Remote URLs:
origin	git@github.com:sinalalebakhsh/acronproject.git (fetch)
origin	git@github.com:sinalalebakhsh/acronproject.git (push)

Recent Commits (last 5):
a29830a 15.12.25 00:22:06 Django project changes:
7bb794c  txt
ec49c53 15.12.25 00:09:16 Django project changes:
74fb926 15.12.25 00:08:54 Django project changes:
9edd466 15.12.25 00:08:16 Django project changes:

Current Status:
Clean working directory

OPERATION COMPLETED SUCCESSFULLY
Time: 2025-12-15 00:22:15
Commit: a29830a

============================================================
[2025-12-15 00:22:33]
============================================================
SCRIPT STOPPED BY USER
Time: 2025-12-15 00:22:33
Total checks performed: 1
Final internet status: Connected
Pending operations: No
Log file: git_auto_log.txt
Max log lines configured: 2000

================================================================================
GIT AUTO SCRIPT STARTED
Time: 2025-12-15 00:31:28
Configuration: {'initial_interval': 60, 'normal_interval': 300, 'initial_checks': 3, 'max_retries': 3, 'error_log_dir': 'git_auto_errors', 'timeout': 10, 'branch': 'main', 'log_file': 'git_auto_log.txt', 'max_log_lines': 2000, 'log_rotation_size': 1000}
Max log lines: 2000
Rotation size: 1000 lines
================================================================================
